id,createdAt,listing,state,rating,content,type,transaction,sentiment
ebcdeb10-12a7-469b-9e10-09904dcc46a8,2022-01-03 13:40:19.920155+00:00,Combinaison noire Kookai T38 | 9974ea39-0425-4c13-b002-eda9f6f9403d,public,5,"Magnifique combi, confortable, très joli décolleté ! merci encore Othilie pour tout :) ",ofProvider,Transaction object (3a2cdc7f-e1fc-4e35-ab11-adac0e4f7cee),POSITIVE
8f32c012-f1e4-491e-92fa-65a62af66803,2022-01-03 12:41:17.992864+00:00,,public,5,Super location ! Envoi rapide après la location :),ofCustomer,Transaction object (3d276500-bcfc-44db-b8ea-042e74ba451f),POSITIVE
b25d71a3-bce1-4596-89a3-397004397090,2022-01-01 17:20:52.628049+00:00,"Veste dorée Maison Guillemette, T.S | 3987517a-01d3-4397-9ad1-8b275567c189",public,5,"Goldie adorable, réactive et arrangeante, une joie de lui louer sa ravissante et scintillante veste ! Une heureuse première expérience avec MGC pour moi, en plus auprès de la fondatrice : parfait et à refaire !",ofProvider,Transaction object (b5e6d6c8-053c-4c5f-ae31-f1ab2a84ab7b),POSITIVE
072f1455-cd4c-411f-9b2c-ef62a75591b8,2021-12-31 17:50:57.422673+00:00,,public,5,"Super sympa, efficace je recommande à 100%",ofCustomer,Transaction object (3a2cdc7f-e1fc-4e35-ab11-adac0e4f7cee),POSITIVE
dcae0d63-4909-4c7b-97fd-863341556081,2021-12-30 11:26:04.896508+00:00,Robe Daly bleu marine + ceinture Maison Guillemette XS | d6b8302d-5dea-4f30-a190-5c1d72e38ad4,public,5,Tout s'est très bien passé. Eva est très arrangeante et disponible. Une jolie robe que je relouerai volontiers 🥰,ofProvider,Transaction object (e9259633-cd80-4eca-85f2-25986e336b40),POSITIVE
b9d05cbf-3fe6-40ca-a5e7-816ee1511658,2021-12-29 19:01:44.226699+00:00,,public,5,Transaction plus que parfaite ! Locataire très très agréable et gentille ! Je recommande ,ofCustomer,Transaction object (6c95c882-8b86-45d1-8f98-a89bad795eff),POSITIVE
0169d771-38e2-4340-a469-649cd1dd04af,2021-12-28 15:57:24.227279+00:00,,public,1,Je déconseille fortement. Je me suis pliée en 4 pour lui envoyer à temps pochette + robe et elle ne m'a payé pour la location de la pochette ainsi que les fdp de celle ci.,ofCustomer,Transaction object (5180e646-d623-4a5e-96f9-3baf901dff13),NEGATIVE
d18bd2d2-f154-4888-9b21-e30de99b03c2,2021-12-22 08:31:24.471011+00:00,Robe rose Tara Jarmon dos nu T 36 | 79b4c6df-4027-474e-bd22-becd471dfeca,public,5,"Robe absolument dingo ! En prime, Clara est arrangeante et adorable, merci encore pour cette super location !",ofProvider,Transaction object (2133d7a8-2de2-4101-be7c-358c1e415ce2),POSITIVE
243d93a8-7892-447b-a47b-367b815ffee8,2021-12-22 08:27:14.647169+00:00,Serre tête fleurs séchées ~ L’Atelier de Clotilde | c3248306-e908-4ab5-9280-1525949dc47c,public,5,"Merci Diane pour cette super location ! Serre tête magnifique, je n'ai eu que des compliments 😍
Diane et arrangeante et adorable !",ofProvider,Transaction object (56c0cbfc-5496-4dc7-a6ad-e805fa0114ee),POSITIVE
31396d62-5f71-402c-8643-92e6bf493703,2021-12-22 08:19:36.510882+00:00,"Robe Gretel Apoluze rouge, T.36 | d428baf3-f07e-4588-9b79-e2cabf3418c4",public,5,Merci Madeleine pour la location ! Super première expérience,ofProvider,Transaction object (450342c8-c940-4255-ac4b-cbf3b4f133e0),POSITIVE
bac7c9b7-172e-45b2-b0bf-efc148accc69,2021-12-22 08:12:23.603686+00:00,Robe Athéna Boutique Libertie | 5f60bd00-6526-47af-9523-6b151847d24f,public,5,Merci encore Juliette pour cette jolie robe !,ofProvider,Transaction object (1b44781f-52db-4bf5-82e0-a7d930180191),POSITIVE
1bd51b2c-dfa7-483b-bb0d-8d83711c6f60,2021-12-22 08:11:51.118326+00:00,,public,5,"Super expérience avec Aude que je recommande vivement, à bientôt peut-être ?",ofCustomer,Transaction object (b4de7034-2101-466a-901f-5254fa3657f0),POSITIVE
10a6d4e4-b75a-4ef8-9799-2d4cbc6752ea,2021-12-22 08:11:11.448423+00:00,,public,5,Super expérience avec Isaure ! Très fiable et arrangeante !,ofCustomer,Transaction object (cc2912d9-bb05-4e4d-af9e-c596f16fc932),POSITIVE
24227379-f0a5-4482-91e7-7571d1a4d99e,2021-12-22 07:47:23.185449+00:00,Capeline | 5f4ec197-7507-4165-a35a-6d631d8be4cc,public,5,Merci Albane pour cette location ! La capeline était magnifique,ofProvider,Transaction object (b593ce3c-90d4-4727-85f4-16f2b2d6ea6b),POSITIVE
15d6bf96-af75-4f79-bb67-7b6aab74a51d,2021-12-21 05:12:12.858065+00:00,Robe Oréanne Stella et Suzie | 8a74e71d-e55b-4607-8f2a-fd571bf4a8a3,public,5,"Merci Aliénor pour cette location, la robe était magnifique !",ofProvider,Transaction object (f4be55a2-b55b-49b9-b315-6d7c66e907ad),POSITIVE
bfb6faef-9740-4858-bf43-1e1f28d0b448,2021-12-21 05:10:23.903085+00:00,"Robe bleue ciel Maison 1.2.3, T.42 | e6bb80dc-99df-4fde-9453-ff547219b71a",public,5,"Merci Hortense pour cette location ! Robe magnifique, à bientôt peut-être ",ofProvider,Transaction object (22480df7-dd1e-4092-964f-fad9b0116c4b),POSITIVE
175599d0-e003-4721-bfdb-49c729991e9e,2021-12-21 04:46:51.095514+00:00,"Robe maison guillemette bleue, T.L | e211e93c-ff40-4785-9a27-4f38d6f07d4a",public,5,"Yolaine est très arrangeante, location absolument parfaite et la robe est magnifique, je recommande vivement !!",ofProvider,Transaction object (956833a5-ae3b-42b9-82d2-641db7b8dbf0),POSITIVE
76ac1b23-2fb5-45f7-b351-3d81c9e8e322,2021-12-21 04:42:28.129970+00:00,Robe argentée Maje T.34 | f6decbd5-43a3-49aa-9af4-e72b85878168,public,5,"Premiere expérience sur Mygoldencloset, et elle est réussie ! Merci encore Alix pour cette jolie robe qui a fait sensation !",ofProvider,Transaction object (77556dd7-c4c5-4c2b-9d8e-94ac1e215e6c),POSITIVE
78bd1bed-8dcd-4e30-ac71-c966665dc2c3,2021-12-21 04:39:16.145227+00:00,,public,5,Au top ! ,ofCustomer,Transaction object (752822f2-a0a6-4ee2-bc0a-2faff7ee8caf),POSITIVE
2bfa5afa-a410-4a97-a0a6-d6f5fdc90518,2021-12-21 04:38:46.828271+00:00,,public,5,"Une super location, Louise est très soigneuse, merci !",ofCustomer,Transaction object (6a16666a-635d-43e2-a9bf-0ad8b5db474b),POSITIVE
5a01a331-38bc-41d0-8022-0e64ab668bd1,2021-12-21 04:36:11.724638+00:00,Robe Ba&sh T2 | 5fd266d8-5ce8-4809-9c97-5aa14cc5cdd9,public,5,"Super première expérience !! Robe magnifique, envoie rapide et soignée, merci encore Anne !!",ofProvider,Transaction object (752822f2-a0a6-4ee2-bc0a-2faff7ee8caf),POSITIVE
78b847e0-ff0f-4ebd-98af-68a3c6a33e38,2021-12-17 15:38:48.032752+00:00,,public,5,"Clara était top : très très sympathique, flexible et soigneuse. Je serais ravie de la croiser à nouveau sur l’appli :)  ",ofCustomer,Transaction object (63f7a581-b394-424f-9f68-7dabf9ff8ad9),POSITIVE
3287bb15-ce79-4f62-953d-2f883619d7f4,2021-12-17 15:35:46.728627+00:00,,public,5,"Agathe était sympathique et disponible, c’était un plaisir de la rencontrer ! ",ofCustomer,Transaction object (c4e2ea4a-9b5c-4dd1-851f-5e00d9c7c92c),POSITIVE
e7bbb468-9fb1-496e-831e-4371d9ab9fd0,2021-12-17 08:47:04.138786+00:00,Elegante capeline | 5d85e13f-8774-4fe3-b11a-35e35e0a2e23,public,5,Au top du top !!,ofProvider,Transaction object (49137467-2b04-4403-b0c3-7ed9c772eeaf),POSITIVE
10114ae4-6bd5-436f-bb92-cd9a07cc9991,2021-12-17 08:46:23.017359+00:00,Robe Sezane Sollie | 5f92b13a-b8d7-4690-adce-6ef1335ff2e9,public,5,"Merci beaucoup Constance pour cette location, arrangeante et très fiable ! À bientôt ",ofProvider,Transaction object (c0ff826d-0810-476c-a6b4-f2b7ea44e5ab),POSITIVE
287d8ecb-1963-44b8-b603-94e70482534c,2021-12-17 08:45:20.744426+00:00,"Robe verte An&be, TS | 9de51bcc-6682-4ffe-90f6-f3be9fe3853d",public,5,Experience au top avec Constance 😍 merci !,ofProvider,Transaction object (3c631fe9-8f23-4845-b6ec-676b8e050f51),POSITIVE
04e732f8-5848-465c-ac2b-d4274af7cdd9,2021-12-17 08:44:37.938398+00:00,Robe jaune dentelle Sandro T. S/36 | 5f89a18f-f4d7-4e8e-9656-efcb1e599a87,public,5,"Merci Alixe pour votre gentillesse et cette belle robe, elle a fait sensation ! À très vite !",ofProvider,Transaction object (32fc1a98-ab63-4690-bfd6-4941c4dfd376),POSITIVE
419c070a-d3b7-4c0b-95ca-ab2555d4bf1c,2021-12-17 08:42:55.198093+00:00,Capeline rose fushia Masario | 5fa0e9be-1dad-4615-b8c1-55e546ba682e,public,5,"Super expérience avec Camille qui a été super arrangeante, merci encore ! Et le chapeau était dingue !",ofProvider,Transaction object (07c8e01d-6d4a-408b-97f7-5bcbc70c9c19),POSITIVE
b3dce927-d0e3-4a88-b379-e87841c4fdd0,2021-12-16 14:27:53.249542+00:00,,public,5,Super expérience avec Lauriane :) un plaisir de t'ouvrir ma garde robe ! ,ofCustomer,Transaction object (67ef2aa4-e2c9-45cb-9ac3-6aa3e1375d7c),POSITIVE
39ea425f-786d-4235-8225-fa71b70bd096,2021-12-16 10:51:11.258392+00:00,Robe Zara manches volants T38 | 5f428a07-d54c-472d-ac05-2b28df13dcf7,public,5,"Deuxième location au top avec Diane, je ne peux que recommander !",ofProvider,Transaction object (e78353d9-ec7c-48ff-a5fd-33785c141385),POSITIVE
637d0851-78bb-4f17-9655-8fe15c2fff35,2021-12-16 10:50:35.110951+00:00,Capeline en paille et hortensias séchés | 5f423064-5adf-4620-b9ca-45f9e486fca8,public,5,"Merci encore Diane ! Capeline de qualité, communication parfaite, une Goldie en or !! À très vite ",ofProvider,Transaction object (f73ac17a-8336-46b9-99af-426d345afa7a),POSITIVE
70b2c355-68f8-4b33-bb70-d11ea2076719,2021-12-16 10:47:57.120817+00:00,Capeline en paille et hortensias séchés | 5f423064-5adf-4620-b9ca-45f9e486fca8,public,5,"Capeline magnifique, Diane est arrangeante et adorable !",ofProvider,Transaction object (0b679b8f-8a5f-4811-8770-7de07a515226),POSITIVE
bc0b3a2a-fb3c-40b8-88cf-7794499b8814,2021-12-16 10:45:58.125439+00:00,,public,5,Super transaction avec Léa-Raphaëlle ! je recommande +++,ofCustomer,Transaction object (51061cc3-b03a-4701-9063-22fee9e358f0),POSITIVE
c8f3917d-8ec9-4d74-9fd9-e488fdba8d20,2021-12-16 10:18:39.658425+00:00,Robe etam corail T34 | a37e7136-b284-499a-b4b7-14f6f044f896,public,5,"Hortense a été très flexible, adorable et arrangeante ! Robe très jolie, je recommande vivement !",ofProvider,Transaction object (df8d2d18-62d5-49b5-813e-d02892dd05cf),POSITIVE
4d7431f2-d0e8-4190-a47e-110bca6c500b,2021-12-16 10:16:34.713561+00:00,Robe Ba&sh T2 | 5fd266d8-5ce8-4809-9c97-5aa14cc5cdd9,public,5,Super location avec Anne !! je n'ai eu que des compliments sur la robe ! Merci encore ++++,ofProvider,Transaction object (6a16666a-635d-43e2-a9bf-0ad8b5db474b),POSITIVE
7210465e-8208-47a4-a1a4-29d4a212598e,2021-12-16 10:14:56.109011+00:00,Robe Sezane Rachelle jaune S | 8f89f8b9-53d2-4f6c-944b-e952cf67fddf,public,5,"Robe magnifique ! Anne-Cécile est une super Goldie qui a accepté de me l'envoyer, je recommande vivement !! Mille mercis ✨",ofProvider,Transaction object (5f279762-8f45-4dd8-bd1a-5320abe24803),POSITIVE
5212640a-a1bd-47be-9a03-01d13207d2fd,2021-12-15 19:49:41.881520+00:00,"Veste dorée Maison Guillemette, T.S | 3987517a-01d3-4397-9ad1-8b275567c189",public,5,Veste absolument magnifique ! Je recommande vivement Anne-Cécile et la veste qui donne du peps !!,ofProvider,Transaction object (4c2b3924-a52f-49c9-8d0c-a4a58bf9afed),POSITIVE
27831a09-3683-4423-84a1-e1ec45800b7d,2021-12-15 19:46:07.778416+00:00,"Robe Sézane Rachelle , T.36 | 29036d53-d59d-456b-8454-f551a613a14c",public,5,Super première expérience ! plateforme au top et la robe était sublime. Merci Hermine pour votre gentillesse,ofProvider,Transaction object (3125ebf0-575e-4a73-b35c-76f70355c7e8),POSITIVE
6671b5cc-3e31-4bcb-883c-9beb40e7f278,2021-12-15 19:43:25.977116+00:00,"Robe Ralina Maje, T.1 | 5ddf9b68-9015-451e-818c-923ce5789f3b",public,5,"Je recommande vivement Madeleine qui a été arrangeante et adorable, merci encore !",ofProvider,Transaction object (67ef2aa4-e2c9-45cb-9ac3-6aa3e1375d7c),POSITIVE
93e3e9ef-15da-415c-a0a6-d5e2723d169d,2021-12-15 18:26:06.271622+00:00,,public,5,Super transaction avec Aude ! Je recommande sans hésiter 🤩,ofCustomer,Transaction object (b4eea659-363a-4230-b18d-3964cc99faac),POSITIVE
9384d4ab-c5c8-4295-8aa0-789595a70b53,2021-12-13 11:33:03.378646+00:00,,public,5,Deuxième expérience avec Lorraine au top !,ofCustomer,Transaction object (8d03fc09-3501-4ea2-b515-6b6d385ea7e4),POSITIVE
8d06b5ea-fdb1-4fca-befc-72500726b3ee,2021-12-13 11:32:44.934546+00:00,,public,5,Je recommande vivement Lorraine ! Rapide et arrangeante ,ofCustomer,Transaction object (e5ef3a2f-6e16-4d3d-9c04-f3a991d7c293),POSITIVE
1af178cd-1016-4b47-ab4d-07dc88541884,2021-12-13 11:32:12.491457+00:00,,public,5,"Je recommande vivement Flore ! Arrangeante soigneuse et rapide pour le retour, un vrai plaisir 😍",ofCustomer,Transaction object (846e3506-f9e5-4f8a-b461-9d56995bc035),POSITIVE
f0fc3668-cef7-408c-b9a3-4e48c2d45592,2021-12-11 13:51:22.736593+00:00,,public,5,"Au top ! La location s’est très bien passée, je recommande vivement Marie-Aimée !",ofCustomer,Transaction object (dac4ddc4-e73d-4866-8a1f-604a0b7d9535),POSITIVE
b66deefa-ae17-4631-a1d2-a8c09fcc2748,2021-12-10 14:10:00.778675+00:00,Body cache coeur noir velours - Flair | a54956fe-c695-47f4-8aed-0cda3d43c66d,public,5,Super expérience! Gersende est tres arrangeante et le body magnifique 🤩,ofProvider,Transaction object (dac4ddc4-e73d-4866-8a1f-604a0b7d9535),POSITIVE
4bef7442-5d9b-47f1-a0b6-5b520603176b,2021-12-07 10:28:12.449233+00:00,,public,5,"Location au top ! Tout s’est ultra bien passé, Inès est très arrangeante et rapidement disponible, je recommande !",ofCustomer,Transaction object (1cdd68f2-b693-4ed0-80f1-7f76d2e6fd0b),POSITIVE
71f6b96e-2bf7-4c77-a71d-46ad8fa85abc,2021-12-06 23:17:11.002927+00:00,"Robe bleue An&Be, T.34/36 | 5f29125b-556a-4d96-ad30-9be3211246b9",public,5,"Merci encore pour ta disponibilité, tout était parfait !! ",ofProvider,Transaction object (0127377a-355b-4f82-9d64-8d4361b8080e),POSITIVE
912a6e08-f914-4eb2-9696-c7c0f945881f,2021-12-06 19:06:59.062829+00:00,"Robe portefeuille Mirae à motif fleuri, T.36 | 79017cbb-4846-4972-a2e3-e757b7a7f516",public,5,Isadora est adorable et très arrangeante. Sa robe est sublime. Je conseille vivement !! ,ofProvider,Transaction object (c4e2ea4a-9b5c-4dd1-851f-5e00d9c7c92c),POSITIVE
9263ca34-32b7-4b7b-8c36-df9c5c277204,2021-12-06 09:14:46.419102+00:00,Magnifique robe Bash Maddie Bleu T1 (T.36-38) | 5d90569b-6a8e-42a6-bbd2-b12c8816c324,public,5,"Super loc, je recommande ! Merci Amélie",ofProvider,Transaction object (846e3506-f9e5-4f8a-b461-9d56995bc035),POSITIVE
abae0c70-8974-4e5e-bc54-b54b16203ad2,2021-12-01 11:27:14.924446+00:00,,public,5,Très bonne expérience !:) ,ofCustomer,Transaction object (25528d7d-5d35-4e56-87dd-d58ea398f9fa),POSITIVE
a6b2c78d-37d4-4b78-b18e-717464ab264c,2021-11-26 07:26:18.635428+00:00,,public,5,Deuxième expérience avec Inès je recommande +++,ofCustomer,Transaction object (c6adb52d-06be-4b51-b108-03644dabc44d),POSITIVE
124129a1-feaa-4563-b22a-c2484a0ec064,2021-11-26 07:25:44.276934+00:00,,public,5,"Je recommande vivement Marie-Alix ! 
Super flex, adorable, et à rendu la combi dans un état comme neuf ! Elle était sublime dans celle-ci 🤩
À très vite !",ofCustomer,Transaction object (bb1296dc-e870-44f0-9fa3-c6b67feb3924),POSITIVE
6df6b5cc-9cca-454f-acc5-36e587e92c07,2021-11-24 08:50:24.469422+00:00,,public,5,"Je recommande vivement Pauline, soigneuse et arrangeante, a bientôt !",ofCustomer,Transaction object (d233c955-2b07-4717-973f-32d147ae9b06),POSITIVE
28dba546-e43e-4ad3-8a5f-178df11c9672,2021-11-24 08:47:57.196025+00:00,,public,5,"Je recommande vivement Constance ! Soigneuse, adorable et très arrangeante. Foncez !!",ofCustomer,Transaction object (1cb603d5-7c77-4ffd-8479-80554838533d),POSITIVE
b013c89a-eb7d-4317-92bf-05a509084abd,2021-11-24 08:47:03.919309+00:00,,public,5,"Je recommande vivement Florence, communication excellente, soigneuse et efficace ! Merci encore et à bientôt !",ofCustomer,Transaction object (50835cf7-efb8-4dcb-9243-ba3adfc00706),POSITIVE
98a49434-a9e1-4be3-a259-159b66d6d3c2,2021-11-24 07:41:30.812105+00:00,Robe Rhodes rose Claudie Pierlot T36 | 1882ad28-7822-44d9-b885-8340357b5379,public,5,"Très bon échange, je recommande !",ofProvider,Transaction object (50835cf7-efb8-4dcb-9243-ba3adfc00706),POSITIVE
571a69c0-b63d-46ba-8be2-fe1503c79538,2021-11-23 16:05:06.341249+00:00,Capeline paille naturelle dorée et fleurs blanches | f29a1301-5513-473f-aed1-88694da04f58,public,5,"Super 1ère expérience sur My Golden Closet! Clara était très sympathique et très arrangeante!! 
La capeline était parfaite! 
Bref, je recommande!! ",ofProvider,Transaction object (f4dc968c-0d60-4d72-a93e-4431028088aa),POSITIVE
a09edc3d-4e7f-458c-83bd-a070c122042d,2021-11-22 06:47:34.691167+00:00,,public,5,"Goldie au top, je recommande ",ofCustomer,Transaction object (a201181e-7d7b-497d-bc07-f7f5fda1e0bb),POSITIVE
da54e0f3-e532-4db8-b9c8-728944518f4f,2021-11-21 20:33:12.738543+00:00,Robe Grégoire Apoluze T.38 | b38f9509-f2eb-4a4b-9960-c7ba352516d6,public,5,"J'ai pu louer une robe et des boucles d'oreilles dans le dressing de Philippine, qui est arrangeante et réactive, je recommande ! ",ofProvider,Transaction object (a201181e-7d7b-497d-bc07-f7f5fda1e0bb),POSITIVE
f014c31c-785a-44b2-ac97-cc2cc6dc2446,2021-11-21 11:23:13.130220+00:00,Robe longue bleue nuit T36-38 | 4ed19296-e284-46c3-962b-c673a0a46e6d,public,5,super location ! Caroline est très arrangeante et sympathique! J'ai eu beaucoup de compliments sur la robe. Merci à Caroline d'avoir rendu ma soirée magique. ,ofProvider,Transaction object (d233c955-2b07-4717-973f-32d147ae9b06),POSITIVE
414591c1-830e-4f93-be63-a7f0a0bb673f,2021-11-17 15:43:36.274476+00:00,,public,5,"Super expérience avec Quitterie, robe rendu rapidement, très soigneuse et adorable ! A bientôt !",ofCustomer,Transaction object (49f4f516-5500-45da-83dd-493e8d593890),POSITIVE
7504fb01-f9c6-4243-b9d8-f9998955d596,2021-11-17 15:42:46.075003+00:00,,public,5,"Je recommande vivement Audrey, très soigneuse et arrangeante !",ofCustomer,Transaction object (aaab0af9-5316-4bd1-ae94-7f5b9cb5ffa2),POSITIVE
0cdc1d67-f1fb-42c1-b7b9-fd43313d6cc8,2021-11-16 08:28:00.772817+00:00,"Combinaison Claude Sezane, T.38 | c77454bb-454e-445b-b54f-d8f6fc0a65e0",public,5,"Très flexible, disponible, super contact et surtout sublime penderie 😍 ! Je recommande ! ",ofProvider,Transaction object (bb1296dc-e870-44f0-9fa3-c6b67feb3924),POSITIVE
62fe4f9a-4e64-46dd-977d-0cf39d11d1cc,2021-11-16 08:25:42.939851+00:00,Accessoire cheveux étamines de porcelaine | 7ed107c7-8fbc-4b13-807e-0aea75a5536d,public,5,"Super contact, rapide et disponible : je recommande :)! ",ofProvider,Transaction object (6b53f2dc-5617-4a00-a662-1de54172ed3b),POSITIVE
96702053-8e31-466b-a5f1-d369e63496a6,2021-11-16 06:07:04.213600+00:00,Robe blanche Zara broderies cotons TS | 5f4abc8b-b82f-4424-8461-de3fee04726e,public,5,"Amélie est très sympathique et arrangeante et la robe est très jolie, même pour une soirée d'hiver ! ",ofProvider,Transaction object (1cb603d5-7c77-4ffd-8479-80554838533d),POSITIVE
2b51ae3c-4a5d-43ec-884b-da8707bb5925,2021-11-15 22:03:20.400753+00:00,"Robe modèle Sia Rojo de Cardie Moda, T.34 | 490bd06f-f750-4a41-b5d8-bad046907f55",public,5,Beatrice est tres arrangeante et tres sympa. La robe rouge est magnifique et en parfait état. Je recommande vivement ! ,ofProvider,Transaction object (8570398b-b42b-41b9-b108-4bb556d001e3),POSITIVE
e38367a9-aca5-4329-b9ca-cb8e1e12a6e1,2021-11-15 19:34:38.183430+00:00,,public,5,"Je recommande vivement Flavie ! Super échanges, rapide et efficace, elle m'a rendu la combi en super état, merci encore ✨",ofCustomer,Transaction object (695120ec-aed0-43b7-9695-723d45ccf41d),POSITIVE
09705b2a-4283-429e-9767-ba31f006940c,2021-11-15 15:55:56.047199+00:00,,public,5,"Bertille est très arrangeante, communication au top :)",ofCustomer,Transaction object (c9a2a47f-8ac1-4e26-8cde-66a9074c3b7e),POSITIVE
eb043f52-cc53-470c-af5f-ed95d372c19c,2021-11-15 13:45:58.712672+00:00,,public,5,"Très bon contact avec Aliénor, échanges fluides et faciles ! J’ai récupéré la robe toute propre très rapidement. Je la recommande les yeux fermés ! ",ofCustomer,Transaction object (2133d7a8-2de2-4101-be7c-358c1e415ce2),POSITIVE
016dc756-4f5e-44cb-a703-9bcce1c80ea7,2021-11-15 13:45:02.499398+00:00,,public,5,Bonne expérience de location avec Louise ! ,ofCustomer,Transaction object (0c822f33-d91c-4f0b-a1e7-08d726d8a116),POSITIVE
628a33ca-faaf-4060-a94d-060454ccf36d,2021-11-14 14:42:07.373440+00:00,Jolie combinaison verte Sezane iris | 5ed0fe26-2c2e-4303-8516-b2eaf241f624,public,5,Super Expérience! Amélie est super sympa et réponds rapidement.,ofProvider,Transaction object (695120ec-aed0-43b7-9695-723d45ccf41d),POSITIVE
a513df53-9575-40b1-ab1d-45e2d46fb4fc,2021-11-12 18:29:12.901542+00:00,Robe Corail An&Be taille S | 5fa0360d-755a-4f35-96c6-0a03f69cc8ac,public,5,"Super expérience, Mathilde est flexible et arrangeante, location parfaite je recommande +++ ",ofProvider,Transaction object (bee3368d-3103-4b15-839b-c2372707dd09),POSITIVE
ffc97481-70e2-45c3-b4ee-2aa28333cbac,2021-11-12 18:19:59.343626+00:00,Capeline paille et oiseaux bleus | f7ee5531-c061-4f89-9d07-57f9435f4f6a,public,5,Chapeau absolument Magnifique ! Merci encore Mahaud pour ta flexibilité !,ofProvider,Transaction object (51061cc3-b03a-4701-9063-22fee9e358f0),POSITIVE
8e5de95d-ec37-4e74-8d73-0b37eb1da543,2021-11-12 11:14:06.157454+00:00,"Combinaison Motus bleu marine satinée, T.1 (34-36) | f3b172bd-f0cd-4159-a3b0-4ae29db2b115",public,5,"Très bonne expérience, tout s’est parfaitement déroulé ! La combi est superbe et Amélie est vraiment sympa et arrangeante, je recommande vivement !",ofProvider,Transaction object (e52f5d4e-d140-4c0d-9d65-b58810802036),POSITIVE
923698ec-5308-4598-af3c-9f56a91b71a8,2021-11-12 10:57:38.966326+00:00,,public,5,"Je recommande vivement Mathilde ! Elle m'a louée ma combinaison bleue Motus, elle était ravie ! Soigneuse arrangeante, c'était parfait ! Je recommande vivement !",ofCustomer,Transaction object (e52f5d4e-d140-4c0d-9d65-b58810802036),POSITIVE
046f406b-714a-4ce0-8366-73d0689872d7,2021-11-12 10:55:04.961563+00:00,,public,5,"Je recommande vivement Alix ! Elle s'est débrouillée pour me rendre la robe plus rapidement que prévu, merci encore !
Soigneuse ++ arrangeante ++ je recommande ++ ❤️",ofCustomer,Transaction object (07d1f373-1568-4751-b1ce-9f8b9cae8af9),POSITIVE
1e37a7ed-6257-40b4-b0be-b466de800c67,2021-11-11 12:16:47.098259+00:00,,public,5,"Très bons échanges avec Corentine, très arrangeante, location super fluide ! Elle m’a rendu la capeline très vite. Je la recommande les yeux fermés ! ",ofCustomer,Transaction object (f4dc968c-0d60-4d72-a93e-4431028088aa),POSITIVE
a512a84d-b8e6-43fe-badf-a262bf0931d7,2021-11-09 11:09:03.890339+00:00,,public,5,"super échange, hyper flexible pour me rapporter ma robe ☺️ Louise était parti pour ma ramsey’s combie bleue et finalement elle a trouvé son bonheur avec ma robe verte fleuries, elle lui allait trop bien ✨",ofCustomer,Transaction object (03c8a946-936c-4e58-b29f-248156050ab0),POSITIVE
d4b4d1ab-7ea2-4206-a204-26d88d14e5bc,2021-11-09 08:17:06.055285+00:00,robe verte dorée M | 5f931e91-2c0b-4aba-bd92-aa3fb1ee8041,public,5,"Très bonne expérience avec Daphné,
Réactive et arrangeante, je recommande !",ofProvider,Transaction object (03c8a946-936c-4e58-b29f-248156050ab0),POSITIVE
f49e116b-0c18-4b11-ba8c-78a160963a4f,2021-11-08 19:56:36.028533+00:00,,public,5,"Bonne communication et très soigneuse, je recommande !",ofCustomer,Transaction object (20aec92e-aa04-4054-833f-2cca6a9de8d7),POSITIVE
ddf02def-e066-4a0b-8e3c-d084cf9fd98f,2021-11-08 19:55:51.691666+00:00,,public,5,"Goldie au top, bonne communication et 0abtalon rendu nickel ",ofCustomer,Transaction object (eb0a32fd-faa8-4eee-bcae-22bcf2a591ed),POSITIVE
c469d41e-bdde-4480-8cbc-c95c4e87e89c,2021-11-06 08:22:04.285616+00:00,Robe midi bash PARI T0 super lumineuse! | 5f4ab02a-7562-4c7e-a776-4308b9da2fe5,public,5,Robe top ! Merci beaucoup ,ofProvider,Transaction object (07d1f373-1568-4751-b1ce-9f8b9cae8af9),POSITIVE
eeafb14a-6fda-4817-8463-7f48a96773dc,2021-11-04 12:19:27.780573+00:00,"Pantalon flare en soie Baptisto, T.34 | 5f6db4c7-2430-4231-b98b-9f07355c34e3",public,5,Je recommande vivement ! le pantalon était magnifique ! Merci encore pour votre réactivité !,ofProvider,Transaction object (eb0a32fd-faa8-4eee-bcae-22bcf2a591ed),POSITIVE
1397feca-249d-49a0-8cfe-2d26a011c70a,2021-11-04 09:25:29.694106+00:00,,public,5,"Je recommande vivement Guenaelle ! Très arrangeante, soigneuse et adorable ! Merci encore ! ",ofCustomer,Transaction object (9f3aac8e-bfc8-4dc9-ab98-16e2d7870ea3),POSITIVE
91e6289e-285d-4680-82b1-f8902376d716,2021-11-04 07:13:25.165256+00:00,,public,5,"Cette location avec Maylis s’est très bien passée. 
Maylis est arrangeante et répond rapidement aux messages ☺️",ofCustomer,Transaction object (cfa75a34-ca3f-4e29-91fd-63717d9f84f7),POSITIVE
ae15334c-645d-47a5-af63-c56a67531833,2021-11-03 13:05:40.716015+00:00,,public,5,"Super ! Guénaëlle est arrangeante sur le lieu de rendez-vous, et rapide pour retourner la robe. Je recommande ! :-)",ofCustomer,Transaction object (6b191787-4280-4cba-9aa3-de13cd9cb2a9),POSITIVE
8c148f55-ac52-45a6-947f-c33b1c4773aa,2021-11-03 10:11:46.043596+00:00,,public,5,"Alix-Anne a été parfaite ! On s’est arrangé pour que la combi ne passe pas par la poste, elle a voyagé entre des mains d’amies à toutes les deux, un bonheur d’avoir eu faire à Alix Anne ! Merci encore pour avoir pris soin de la combi 😍 à très vite ",ofCustomer,Transaction object (abfba3f3-f28c-4236-b282-359483816238),POSITIVE
0c2a5142-a094-4279-a01e-1b78133f2af7,2021-11-02 22:59:23.293115+00:00,Chapeau Les Petites Mésanges | 63aa0087-babe-4244-a19c-654bc2f4fdcf,public,5,Merci encore pour la capeline Anne-Cécile et votre flexibilité ! Je n'ai eu que des compliments !,ofProvider,Transaction object (089048ee-1043-49cd-9e29-47a83bff6bbd),POSITIVE
7a5ea213-8f2d-4c87-aa25-ebd86a7ac3c3,2021-11-02 09:33:09.057690+00:00,Veste rouge Claudie Pierlot | 5fa3ba59-20a2-4fea-8ecb-2e596684ba02,public,5,"Très jolie veste, que des compliments reçus! Merci Isaure !",ofProvider,Transaction object (0d509a27-b42e-41a0-8bf2-f43ff84b9a61),POSITIVE
